{
  "name": "Yandex \u00b7 SerpApi",
  "links": {
    "docs": "https://serpapi.com/yandex-search-api",
    "github": "https://github.com/dhruv-anand-aintech/anysearch",
    "website": "https://yandex.com",
    "slug": "serpapi_yandex"
  },
  "env_keys": {
    "value": "SERPAPI_API_KEY, SERPAPI_KEY",
    "source_url": "https://serpapi.com/search-api",
    "comment": "Same SerpApi key for all engines; anysearch uses `engine=\"yandex\"`."
  },
  "python_extra": {
    "value": "google-search-results",
    "source_url": "https://pypi.org/project/google-search-results/",
    "comment": "pip extra `serpapi`; call with `provider=\"serpapi\"`, `engine=\"yandex\"`."
  },
  "requires_key": {
    "support": "full",
    "source_url": "https://serpapi.com/search-api",
    "comment": "Valid API key required for every request."
  },
  "snippet": {
    "support": "full",
    "source_url": "https://serpapi.com/yandex-search-api",
    "comment": "Organic results via SerpApi `engine=yandex`."
  },
  "domains": {
    "support": "none",
    "source_url": "https://serpapi.com/yandex-search-api",
    "comment": "Domain filters"
  },
  "country": {
    "support": "full",
    "source_url": "https://serpapi.com/yandex-search-api",
    "comment": "`lr` \u2014 Yandex region id when supported."
  },
  "language": {
    "support": "full",
    "source_url": "https://serpapi.com/yandex-search-api",
    "comment": "Language via Yandex-specific params (see SerpApi docs)."
  },
  "date": {
    "support": "none",
    "source_url": "https://serpapi.com/yandex-search-api",
    "comment": "Published date range"
  },
  "safe_search": {
    "support": "full",
    "source_url": "https://serpapi.com/yandex-search-api",
    "comment": "Safe search"
  },
  "answer": {
    "support": "partial",
    "source_url": "https://serpapi.com/yandex-search-api",
    "comment": "Answer box when the engine JSON includes one (not explicitly requested)."
  },
  "content": {
    "support": "none",
    "source_url": "https://serpapi.com/yandex-search-api",
    "comment": "Full page text"
  },
  "summary": {
    "support": "none",
    "source_url": "https://serpapi.com/yandex-search-api",
    "comment": "AI per-result summary"
  },
  "highlights": {
    "support": "none",
    "source_url": "https://serpapi.com/yandex-search-api",
    "comment": "Query highlights"
  },
  "news": {
    "support": "none",
    "source_url": "https://serpapi.com/yandex-search-api",
    "comment": "News via SerpApi where a dedicated news engine exists for this backend."
  },
  "mode": {
    "values": [
      "balanced"
    ],
    "source_url": "https://serpapi.com/yandex-search-api",
    "comment": "Fixed SerpApi backend `engine=yandex` (set via anysearch `engine=\"yandex\"` with `provider=\"serpapi\"`). No separate fast/deep tier on this engine."
  },
  "pricing_per_1k": {
    "value": "$25/month for 1K; $75/5K; $150/15K; $275/30K searches",
    "source_url": "https://serpapi.com/pricing",
    "comment": "Units and commitments differ; do not rank these as equivalent flat per-query prices. ",
    "primary_price": {
      "amount_usd_per_1k": 25,
      "billing_unit": "starter searches",
      "basis": "$25 monthly plan; larger plans differ",
      "source_url": "https://serpapi.com/pricing",
      "checked_at": "2026-10-21"
    },
    "lowest_price": {
      "amount_usd_per_1k": 9.17,
      "billing_unit": "searches at 30K/month",
      "basis": "$275/month for 30K searches (about $9.17 / 1K); $25 / 1K at the 1K starter tier",
      "source_url": "https://serpapi.com/pricing",
      "checked_at": "2026-10-21"
    },
    "links": {}
  },
  "free_tier_limits": {
    "value": "250 searches/month; 50/hour",
    "source_url": "https://serpapi.com/pricing",
    "comment": "Trial, monthly credits and model-tool promotions are distinct. ",
    "links": {}
  },
  "p50_latency": {
    "value": "Historical July 2026: Light API: 1.28s p50 independent; fastest Google API: 0.73s avg / 1.45s p99 vendor-run",
    "source_url": "https://proxyway.com/research/search-apis-2026-report",
    "comment": "Historical evidence retained from July 2026; not remeasured or claimed current. Independent p50 is for SerpApi Light, not a specific engine. SerpApi's own 100-plus-query comparison reports average and p99 for its fastest Google API; anysearch engine-specific latency remains unreported.",
    "links": {
      "Independent benchmark": "https://proxyway.com/research/search-apis-2026-report",
      "Provider benchmark": "https://serpapi.com/blog/who-has-the-fastest-google-search-api/"
    }
  },
  "notes": "SerpApi proxy to Yandex (`engine=yandex`). Native SDK package: google-search-results.",
  "api_category": {
    "value": "Third-party SERP service",
    "source_url": "https://serpapi.com/pricing",
    "comment": ""
  },
  "api_status": {
    "value": "Available",
    "source_url": "https://serpapi.com/pricing",
    "comment": "",
    "links": {}
  },
  "native_api": {
    "value": "Third-party SERP access to multiple engines; not official Google/Bing developer API.",
    "source_url": "https://serpapi.com/pricing",
    "comment": "",
    "links": {}
  },
  "rate_limits": {
    "value": "Starter 200/hour; Developer 1,000/hour",
    "source_url": "https://serpapi.com/pricing",
    "comment": "",
    "links": {}
  },
  "checked_at": {
    "value": "2026-10-21",
    "source_url": "https://serpapi.com/pricing",
    "comment": "Official public documentation reviewed; no paid API or benchmark run. ",
    "links": {}
  },
  "capability_basis": {
    "value": "Existing SDK mappings",
    "source_url": "https://serpapi.com/pricing",
    "comment": "SDK availability is separate from native provider capability. Each native feature cell carries its own checked date and evidence."
  },
  "sdk_support": {
    "value": "Python + TypeScript adapters",
    "source_url": "https://github.com/dhruv-anand-aintech/anysearch",
    "comment": "SDK adapter availability only. See Capability basis for the feature rows; native features do not imply an SDK adapter."
  },
  "evidence": {
    "checked_at": "2026-10-21",
    "source_urls": [
      "https://serpapi.com/pricing"
    ],
    "effective_date": null,
    "method": "official documentation; no new benchmarks"
  }
}
