{
  "name": "Parallel",
  "links": {
    "docs": "https://docs.parallel.ai/search/modes",
    "github": "https://github.com/dhruv-anand-aintech/anysearch",
    "website": "https://parallel.ai",
    "slug": "parallel"
  },
  "env_keys": {
    "value": "PARALLEL_API_KEY",
    "source_url": "https://docs.parallel.ai/getting-started/overview",
    "comment": "API keys and configuration variables documented by the provider."
  },
  "python_extra": {
    "value": "parallel-web",
    "source_url": "https://pypi.org/project/parallel-web/",
    "comment": "Optional PyPI package: parallel-web (install via anysearch-sdk extra `parallel`)."
  },
  "requires_key": {
    "support": "full",
    "source_url": "https://docs.parallel.ai/getting-started/overview",
    "comment": "Valid API key required for every request."
  },
  "snippet": {
    "support": "full",
    "source_url": "https://docs.parallel.ai/search/modes",
    "comment": "Search API ranked result excerpts. Task API is not a snippet SERP \u2014 structured task output."
  },
  "domains": {
    "support": "full",
    "source_url": "https://docs.parallel.ai/search/advanced-search-settings",
    "comment": "Search API: `advanced_settings.source_policy` domain allow/deny. Task API has no domain filter knob."
  },
  "country": {
    "support": "full",
    "source_url": "https://docs.parallel.ai/search/advanced-search-settings",
    "comment": "Search API `advanced_settings.location` (ISO 3166-1 alpha-2). Not on Task API."
  },
  "language": {
    "support": "none",
    "source_url": "https://docs.parallel.ai/search/modes",
    "comment": "Language"
  },
  "date": {
    "support": "full",
    "source_url": "https://docs.parallel.ai/search/advanced-search-settings",
    "comment": "Search API `source_policy.after_date` for freshness. Task API has no date filter."
  },
  "safe_search": {
    "support": "none",
    "source_url": "https://docs.parallel.ai/search/modes",
    "comment": "Safe search"
  },
  "answer": {
    "support": "full",
    "source_url": "https://docs.parallel.ai/task-api/guides/access-research-basis",
    "comment": "Task API synthesized output plus `basis` (citations, reasoning, confidence). Search API returns ranked excerpts only."
  },
  "content": {
    "support": "full",
    "source_url": "https://docs.parallel.ai/api-reference/search/search",
    "comment": "Search API: pre-compressed excerpts (`excerpt_settings` optional). Task API: text/JSON/markdown via `task_spec.output_schema`."
  },
  "summary": {
    "support": "none",
    "source_url": "https://docs.parallel.ai/search/modes",
    "comment": "AI per-result summary"
  },
  "highlights": {
    "support": "full",
    "source_url": "https://docs.parallel.ai/search/best-practices",
    "comment": "Ranked excerpts per URL are the default Search API payload (not Task API)."
  },
  "news": {
    "support": "none",
    "source_url": "https://docs.parallel.ai/search/modes",
    "comment": "News search type"
  },
  "mode": {
    "values": [
      "fast",
      "balanced",
      "deep"
    ],
    "source_url": "https://docs.parallel.ai/search/modes",
    "comment": "**Search API** `mode`: `basic`\u2192fast, `advanced`\u2192balanced (richer retrieval, not synthesis). **Task API** (`POST /v1/tasks/runs`) `processor`: Lite/Base\u2192fast, Core\u2192balanced, Pro/Ultra\u2192deep (structured output with citations). Same `PARALLEL_API_KEY`."
  },
  "pricing_per_1k": {
    "value": "Turbo/Fast $1; Basic/Advanced $5 / 1K (10 results); +$1 / 1K additional results",
    "source_url": "https://docs.parallel.ai/getting-started/pricing",
    "comment": "Units and commitments differ; do not rank these as equivalent flat per-query prices. ",
    "primary_price": {
      "amount_usd_per_1k": 1,
      "billing_unit": "Turbo/Fast requests",
      "basis": "Basic/Advanced $5; extra results billed",
      "source_url": "https://docs.parallel.ai/getting-started/pricing",
      "checked_at": "2026-10-21"
    },
    "links": {
      "Official source 1": "https://parallel.ai/pricing",
      "Official source 2": "https://parallel.ai/blog/free-tier-parallel",
      "Official source 3": "https://docs.parallel.ai/resources/faqs"
    }
  },
  "free_tier_limits": {
    "value": "Up to $80 signup; eligible card-backed organizations $5 monthly credit",
    "source_url": "https://docs.parallel.ai/getting-started/pricing",
    "comment": "Trial, monthly credits and model-tool promotions are distinct. ",
    "links": {
      "Official source 1": "https://parallel.ai/pricing",
      "Official source 2": "https://parallel.ai/blog/free-tier-parallel",
      "Official source 3": "https://docs.parallel.ai/resources/faqs"
    }
  },
  "p50_latency": {
    "value": "Historical July 2026: Search turbo: 0.216s p50; basic: 1.3s; advanced: 2.7s; Task: 10s\u20132h by processor",
    "source_url": "https://parallel.ai/benchmarks",
    "comment": "Historical evidence retained from July 2026; not remeasured or claimed current. Turbo is Parallel's vendor-run July 2026 p50 from us-central. Basic and advanced are competitor-run figures published by Exa. Task API ranges are provider docs and vary from lite-fast (10\u201320s) through ultra8x (5m\u20132h).",
    "links": {
      "Turbo benchmark": "https://parallel.ai/benchmarks",
      "Basic and advanced": "https://exa.ai/products/search",
      "Task processors": "https://docs.parallel.ai/task-api/guides/choose-a-processor"
    }
  },
  "notes": "Native SDK package: parallel-web. Search API is in the anysearch SDK; Task API (`POST /v1/tasks/runs`) is documented in the matrix but not wired in the SDK yet.",
  "api_category": {
    "value": "Standalone search API",
    "source_url": "https://docs.parallel.ai/getting-started/pricing",
    "comment": ""
  },
  "api_status": {
    "value": "Available",
    "source_url": "https://docs.parallel.ai/getting-started/pricing",
    "comment": "",
    "links": {
      "Official source 1": "https://parallel.ai/pricing",
      "Official source 2": "https://parallel.ai/blog/free-tier-parallel",
      "Official source 3": "https://docs.parallel.ai/resources/faqs"
    }
  },
  "native_api": {
    "value": "Search and Extract differ from Task processors. Spending limits are notification-only, not hard blocks.",
    "source_url": "https://docs.parallel.ai/getting-started/pricing",
    "comment": "",
    "links": {
      "Official source 1": "https://parallel.ai/pricing",
      "Official source 2": "https://parallel.ai/blog/free-tier-parallel",
      "Official source 3": "https://docs.parallel.ai/resources/faqs"
    }
  },
  "rate_limits": {
    "value": "Extract $1 / 1K URLs; account limits per plan",
    "source_url": "https://docs.parallel.ai/getting-started/pricing",
    "comment": "",
    "links": {
      "Official source 1": "https://parallel.ai/pricing",
      "Official source 2": "https://parallel.ai/blog/free-tier-parallel",
      "Official source 3": "https://docs.parallel.ai/resources/faqs"
    }
  },
  "checked_at": {
    "value": "2026-10-21",
    "source_url": "https://docs.parallel.ai/getting-started/pricing",
    "comment": "Official public documentation reviewed; no paid API or benchmark run. ",
    "links": {
      "Official source 1": "https://parallel.ai/pricing",
      "Official source 2": "https://parallel.ai/blog/free-tier-parallel",
      "Official source 3": "https://docs.parallel.ai/resources/faqs"
    }
  },
  "capability_basis": {
    "value": "Existing SDK mappings",
    "source_url": "https://docs.parallel.ai/getting-started/pricing",
    "comment": "SDK availability is separate from native provider capability. Each native feature cell carries its own checked date and evidence."
  },
  "sdk_support": {
    "value": "Python + TypeScript adapters",
    "source_url": "https://github.com/dhruv-anand-aintech/anysearch",
    "comment": "SDK adapter availability only. See Capability basis for the feature rows; native features do not imply an SDK adapter."
  },
  "evidence": {
    "checked_at": "2026-10-21",
    "source_urls": [
      "https://docs.parallel.ai/getting-started/pricing",
      "https://parallel.ai/pricing",
      "https://parallel.ai/blog/free-tier-parallel",
      "https://docs.parallel.ai/resources/faqs"
    ],
    "effective_date": null,
    "method": "official documentation; no new benchmarks"
  }
}
