{
  "name": "Searchapi",
  "links": {
    "docs": "https://www.searchapi.io/docs/google",
    "github": "https://github.com/dhruv-anand-aintech/anysearch",
    "website": "https://www.searchapi.io",
    "slug": "searchapi"
  },
  "env_keys": {
    "value": "SEARCHAPI_API_KEY, SEARCHAPI_KEY",
    "source_url": "https://www.searchapi.io/docs/google",
    "comment": "API keys and configuration variables documented by the provider."
  },
  "python_extra": {
    "value": "\u2014 (REST only)",
    "source_url": "https://www.searchapi.io/docs/google",
    "comment": "HTTP API only; no required vendor Python SDK."
  },
  "requires_key": {
    "support": "full",
    "source_url": "https://www.searchapi.io/docs/google",
    "comment": "Valid API key required for every request."
  },
  "snippet": {
    "support": "full",
    "source_url": "https://www.searchapi.io/docs/google",
    "comment": "Short description field returned with each result."
  },
  "domains": {
    "support": "none",
    "source_url": "https://www.searchapi.io/docs/google",
    "comment": "Domain filters"
  },
  "country": {
    "support": "full",
    "source_url": "https://www.searchapi.io/docs/google",
    "comment": "`gl` parameter on Google engine requests."
  },
  "language": {
    "support": "full",
    "source_url": "https://www.searchapi.io/docs/google",
    "comment": "`hl` \u2014 language of the SERP."
  },
  "date": {
    "support": "none",
    "source_url": "https://www.searchapi.io/docs/google",
    "comment": "Published date range"
  },
  "safe_search": {
    "support": "none",
    "source_url": "https://www.searchapi.io/docs/google",
    "comment": "Safe search"
  },
  "answer": {
    "support": "partial",
    "source_url": "https://www.searchapi.io/docs/google",
    "comment": "Featured snippets / answer box when returned by the engine."
  },
  "content": {
    "support": "none",
    "source_url": "https://www.searchapi.io/docs/google",
    "comment": "Full page text"
  },
  "summary": {
    "support": "none",
    "source_url": "https://www.searchapi.io/docs/google",
    "comment": "AI per-result summary"
  },
  "highlights": {
    "support": "none",
    "source_url": "https://www.searchapi.io/docs/google",
    "comment": "Query highlights"
  },
  "news": {
    "support": "full",
    "source_url": "https://www.searchapi.io/docs/google-news",
    "comment": "Use the Google News engine for news results."
  },
  "mode": {
    "values": [
      "balanced"
    ],
    "source_url": "https://www.searchapi.io/docs/google",
    "comment": "Google engine wrapper: single SERP depth per request (no native fast/deep tier)."
  },
  "pricing_per_1k": {
    "value": "$40/month/10K; $100/35K; $250/100K; $500/250K standard-speed requests",
    "source_url": "https://www.searchapi.io/pricing",
    "comment": "Units and commitments differ; do not rank these as equivalent flat per-query prices. ",
    "primary_price": {
      "amount_usd_per_1k": 4,
      "billing_unit": "standard starter requests",
      "basis": "$40/month for 10K requests",
      "source_url": "https://www.searchapi.io/pricing",
      "checked_at": "2026-10-21"
    },
    "lowest_price": {
      "amount_usd_per_1k": 2.0,
      "billing_unit": "standard requests at 250K/month",
      "basis": "$500/month for 250K standard requests ($2 / 1K); $4 / 1K at the 10K starter tier",
      "source_url": "https://www.searchapi.io/pricing",
      "checked_at": "2026-10-21"
    },
    "links": {}
  },
  "free_tier_limits": {
    "value": "100 one-time signup requests; no card",
    "source_url": "https://www.searchapi.io/pricing",
    "comment": "Trial, monthly credits and model-tool promotions are distinct. ",
    "links": {}
  },
  "p50_latency": {
    "value": "Historical July 2026: Light API: 1.07s p50 / 2.23s p95; standard API: not published",
    "source_url": "https://proxyway.com/research/search-apis-2026-report",
    "comment": "Historical evidence retained from July 2026; not remeasured or claimed current. Independent three-run benchmark. The figure is for SearchAPI Light; the standard Google endpoint used by anysearch was not separately reported.",
    "links": {
      "Independent benchmark": "https://proxyway.com/research/search-apis-2026-report"
    }
  },
  "notes": "",
  "api_category": {
    "value": "Third-party SERP service",
    "source_url": "https://www.searchapi.io/pricing",
    "comment": ""
  },
  "api_status": {
    "value": "Available",
    "source_url": "https://www.searchapi.io/pricing",
    "comment": "",
    "links": {}
  },
  "native_api": {
    "value": "Third-party SERP service; only HTTP-200 success billed; $100/35K equals ~$2.86 / 1K.",
    "source_url": "https://www.searchapi.io/pricing",
    "comment": "",
    "links": {}
  },
  "rate_limits": {
    "value": "Entry plan $40/month; enhanced speed may differ",
    "source_url": "https://www.searchapi.io/pricing",
    "comment": "",
    "links": {}
  },
  "checked_at": {
    "value": "2026-10-21",
    "source_url": "https://www.searchapi.io/pricing",
    "comment": "Official public documentation reviewed; no paid API or benchmark run. ",
    "links": {}
  },
  "capability_basis": {
    "value": "Existing SDK mappings",
    "source_url": "https://www.searchapi.io/pricing",
    "comment": "SDK availability is separate from native provider capability. Each native feature cell carries its own checked date and evidence."
  },
  "sdk_support": {
    "value": "Python + TypeScript adapters",
    "source_url": "https://github.com/dhruv-anand-aintech/anysearch",
    "comment": "SDK adapter availability only. See Capability basis for the feature rows; native features do not imply an SDK adapter."
  },
  "evidence": {
    "checked_at": "2026-10-21",
    "source_urls": [
      "https://www.searchapi.io/pricing"
    ],
    "effective_date": null,
    "method": "official documentation; no new benchmarks"
  }
}
