{
  "name": "Bright Data",
  "links": {
    "slug": "brightdata",
    "docs": "https://brightdata.com/pricing/serp",
    "website": "https://brightdata.com"
  },
  "env_keys": {
    "value": "Not integrated",
    "source_url": "https://brightdata.com/pricing/serp",
    "comment": "Comparison only; anysearch does not read a key for this provider."
  },
  "python_extra": {
    "value": "Not integrated",
    "source_url": "https://brightdata.com/pricing/serp",
    "comment": ""
  },
  "mode": {
    "values": [
      "SERP",
      "Fast SERP"
    ],
    "comment": "Fast SERP has separate access requirements; no anysearch fast/balanced/deep mapping.",
    "source_url": "https://docs.brightdata.com/products/serp-api/fast-serp/quickstart",
    "checked_at": "2026-10-21"
  },
  "p50_latency": {
    "value": "No current comparable measurement verified",
    "source_url": "https://brightdata.com/pricing/serp",
    "comment": ""
  },
  "notes": "Comparison only; no anysearch SDK adapter is claimed.",
  "comparison_only": true,
  "requires_key": {
    "support": "full",
    "comment": "REST request API requires bearer API key; proxy interface uses zone credentials.",
    "source_url": "https://docs.brightdata.com/api-reference/rest-api/serp/serp-api",
    "checked_at": "2026-10-21",
    "basis": "native API documentation"
  },
  "snippet": {
    "support": "full",
    "comment": "Parsed organic results expose description (search snippet).",
    "source_url": "https://docs.brightdata.com/products/serp-api/parsed-json-results",
    "checked_at": "2026-10-21",
    "basis": "native API documentation"
  },
  "domains": {
    "support": "partial",
    "comment": "Indirect engine query operator: provider forwards q in a Google search URL, and Google documents site:. This documented composition is not a typed domain allow/deny guarantee.",
    "source_url": "https://docs.brightdata.com/products/serp-api/query-parameters/google",
    "checked_at": "2026-10-21",
    "basis": "native API documentation",
    "links": {
      "Google site: operator": "https://developers.google.com/search/docs/monitor-debug/search-operators/all-search-site"
    }
  },
  "country": {
    "support": "full",
    "comment": "gl selects two-letter search country; localization is documented.",
    "source_url": "https://docs.brightdata.com/products/serp-api/query-parameters/google",
    "checked_at": "2026-10-21",
    "basis": "native API documentation"
  },
  "language": {
    "support": "full",
    "comment": "hl sets page/interface language; engine-supported language semantics, not a guarantee every result has that language.",
    "source_url": "https://docs.brightdata.com/products/serp-api/query-parameters/google",
    "checked_at": "2026-10-21",
    "basis": "native API documentation"
  },
  "date": {
    "support": "partial",
    "comment": "tbs filters publication time by engine-supported ranges; engine-specific date syntax rather than typed start/end fields.",
    "source_url": "https://docs.brightdata.com/products/serp-api/query-parameters/google",
    "checked_at": "2026-10-21",
    "basis": "native API documentation"
  },
  "safe_search": {
    "support": "full",
    "comment": "safe=active or safe=off enables/disables Google SafeSearch.",
    "source_url": "https://docs.brightdata.com/products/serp-api/query-parameters/google",
    "checked_at": "2026-10-21",
    "basis": "native API documentation"
  },
  "answer": {
    "support": "partial",
    "comment": "Parsed Google ai_overview is available when the upstream SERP includes it; no guaranteed independent synthesized answer.",
    "source_url": "https://docs.brightdata.com/products/serp-api/query-parameters/google",
    "checked_at": "2026-10-21",
    "basis": "native API documentation"
  },
  "content": {
    "support": "none",
    "comment": "Parsed JSON/HTML/Markdown formats describe the SERP response, not fetched full text of linked result pages. Separate scraper products are outside this column.",
    "source_url": "https://docs.brightdata.com/products/serp-api/parsed-json-results",
    "checked_at": "2026-10-21",
    "basis": "native API documentation"
  },
  "summary": {
    "support": "none",
    "comment": "The documented organic response has description snippets, not generated per-result page summaries. Upstream AI Overview is a separate SERP element.",
    "source_url": "https://docs.brightdata.com/products/serp-api/parsed-json-results",
    "checked_at": "2026-10-21",
    "basis": "native API documentation"
  },
  "highlights": {
    "support": "partial",
    "comment": "snippet_highlighted_words exposes engine-highlighted terms, not a standalone excerpt generation service.",
    "source_url": "https://docs.brightdata.com/products/serp-api/parsed-json-results",
    "checked_at": "2026-10-21",
    "basis": "native API documentation"
  },
  "news": {
    "support": "full",
    "comment": "tbm=nws selects Google News results; dedicated Fast SERP News also documented.",
    "source_url": "https://docs.brightdata.com/products/serp-api/query-parameters/google",
    "checked_at": "2026-10-21",
    "basis": "native API documentation"
  },
  "api_category": {
    "value": "Third-party SERP service",
    "source_url": "https://brightdata.com/pricing/serp",
    "comment": ""
  },
  "api_status": {
    "value": "Available",
    "source_url": "https://brightdata.com/pricing/serp",
    "comment": "",
    "links": {}
  },
  "native_api": {
    "value": "SERP proxy; requests are not individual organic links; async collection not another billed request.",
    "source_url": "https://brightdata.com/pricing/serp",
    "comment": "",
    "links": {}
  },
  "rate_limits": {
    "value": "PAYG deposit minimum not verified",
    "source_url": "https://brightdata.com/pricing/serp",
    "comment": "",
    "links": {}
  },
  "checked_at": {
    "value": "2026-10-21",
    "source_url": "https://brightdata.com/pricing/serp",
    "comment": "Official public documentation reviewed; no paid API or benchmark run. ",
    "links": {}
  },
  "capability_basis": {
    "value": "Native API \u2014 reviewed",
    "source_url": "https://brightdata.com/pricing/serp",
    "comment": "SDK availability is separate from native provider capability. Each native feature cell carries its own checked date and evidence."
  },
  "sdk_support": {
    "value": "Comparison only \u2014 no adapter",
    "source_url": "https://github.com/dhruv-anand-aintech/anysearch",
    "comment": "SDK adapter availability only. See Capability basis for the feature rows; native features do not imply an SDK adapter."
  },
  "pricing_per_1k": {
    "value": "PAYG $1.50 / 1K successful requests; Scale $499/month includes 380K then $1.30 / 1K",
    "source_url": "https://brightdata.com/pricing/serp",
    "comment": "Units and commitments differ; do not rank these as equivalent flat per-query prices. ",
    "primary_price": {
      "amount_usd_per_1k": 1.5,
      "billing_unit": "successful PAYG SERP requests",
      "basis": "Other plans differ",
      "source_url": "https://brightdata.com/pricing/serp",
      "checked_at": "2026-10-21"
    },
    "links": {}
  },
  "free_tier_limits": {
    "value": "5,000 requests/month free; no card",
    "source_url": "https://brightdata.com/pricing/serp",
    "comment": "Trial, monthly credits and model-tool promotions are distinct. ",
    "links": {}
  },
  "evidence": {
    "checked_at": "2026-10-21",
    "source_urls": [
      "https://brightdata.com/pricing/serp",
      "https://docs.brightdata.com/api-reference/rest-api/serp/serp-api",
      "https://docs.brightdata.com/products/serp-api/parsed-json-results",
      "https://docs.brightdata.com/products/serp-api/query-parameters/google",
      "https://developers.google.com/search/docs/monitor-debug/search-operators/all-search-site",
      "https://docs.brightdata.com/products/serp-api/fast-serp/quickstart"
    ],
    "effective_date": null,
    "method": "official documentation; no new benchmarks"
  }
}
